{
  "$schema": "https://json-schema.org/draft/2020-12/schema",
  "$id": "https://github.com/Astraive/loxa-spec/spec/schemas/json/event.schema.json",
  "title": "LOXA Event",
  "type": "object",
  "required": [
    "schema_version",
    "event_version",
    "event_id",
    "timestamp",
    "service",
    "event",
    "kind"
  ],
  "properties": {
    "event_id": {
      "type": "string",
      "minLength": 1,
      "x-loxa-since": "v1"
    },
    "timestamp": {
      "type": "string",
      "format": "date-time",
      "pattern": "^\\d{4}-\\d{2}-\\d{2}T\\d{2}:\\d{2}:\\d{2}(?:\\.\\d+)?(?:Z|[+-]\\d{2}:\\d{2})$"
    },
    "schema_version": {
      "type": "string",
      "enum": ["v1"]
    },
    "event_version": {
      "type": "string",
      "enum": ["v1"]
    },
    "service": {
      "oneOf": [
        {
          "type": "string",
          "minLength": 1
        },
        {
          "type": "object",
          "required": ["name"],
          "properties": {
            "name": {
              "type": "string",
              "minLength": 1
            },
            "version": {
              "type": "string"
            }
          },
          "additionalProperties": true
        }
      ],
      "x-loxa-since": "v1"
    },
    "version": {
      "type": "string"
    },
    "release": {
      "type": "string"
    },
    "trace_flags": {
      "type": "string"
    },
    "environment": {
      "type": "string",
      "x-loxa-deprecated": "use deployment.environment",
      "x-loxa-since": "v1"
    },
    "deployment": {
      "type": "object",
      "properties": {
        "environment": {
          "type": "string"
        },
        "region": {
          "type": "string"
        }
      },
      "additionalProperties": true,
      "x-loxa-since": "v1"
    },
    "source": {
      "type": "object",
      "properties": {
        "sdk": {
          "oneOf": [
            {
              "type": "string"
            },
            {
              "type": "object",
              "properties": {
                "name": {
                  "type": "string"
                },
                "version": {
                  "type": "string"
                }
              },
              "additionalProperties": true
            }
          ]
        },
        "instance_id": {
          "type": "string"
        }
      },
      "additionalProperties": true,
      "x-loxa-since": "v1"
    },
    "event": {
      "type": "string",
      "minLength": 1
    },
    "kind": {
      "type": "string",
      "enum": ["event", "http", "job", "queue", "cli", "cron", "log", "checkpoint", "agent", "ai"]
    },
    "message": {
      "type": "string"
    },
    "level": {
      "type": "string",
      "enum": ["debug", "info", "notice", "warn", "error", "fatal"]
    },
    "outcome": {
      "type": "string",
      "enum": ["success", "error", "partial", "abandoned", "retried", "cancelled", "timeout", "skipped", "rejected", "quarantined", "unknown"]
    },
    "duration_ms": {
      "type": "integer",
      "minimum": 0
    },
    "started_at": {
      "type": "string",
      "format": "date-time"
    },
    "finished_at": {
      "type": "string",
      "format": "date-time"
    },
    "partial": {
      "type": "boolean"
    },
    "partial_reason": {
      "type": "string",
      "enum": ["not_finished", "process_exit", "timeout", "panic", "collector_unavailable"]
    },
    "event_state": {
      "type": "string",
      "enum": [
        "created",
        "active",
        "finished",
        "emitting",
        "emitted",
        "invalid",
        "dropped",
        "emit_failed",
        "spooled",
        "dlq_written",
        "failed_validation",
        "delivery_failed"
      ],
      "x-loxa-since": "v1"
    },
    "delivery_attempts": {
      "type": "integer",
      "minimum": 0
    },
    "request_id": {
      "type": "string"
    },
    "trace_id": {
      "type": "string"
    },
    "span_id": {
      "type": "string"
    },
    "incident_id": {
      "type": "string"
    },
    "method": {
      "type": "string"
    },
    "path": {
      "type": "string"
    },
    "route": {
      "type": "string"
    },
    "status_code": {
      "type": "integer",
      "minimum": 100,
      "maximum": 599
    },
    "http": {
      "type": "object",
      "properties": {
        "method": {
          "type": "string"
        },
        "path": {
          "type": "string"
        },
        "route": {
          "type": "string"
        },
        "status_code": {
          "type": "integer",
          "minimum": 100,
          "maximum": 599
        },
        "client_ip": {
          "type": "string"
        },
        "user_agent": {
          "type": "string"
        },
        "url": {
          "type": "string"
        },
        "host": {
          "type": "string"
        }
      },
      "additionalProperties": true
    },
    "error": {
      "type": "object",
      "properties": {
        "type": {
          "type": "string"
        },
        "message": {
          "type": "string"
        },
        "code": {
          "type": "string"
        },
        "retriable": {
          "type": "boolean"
        },
        "cause": {
          "type": "string"
        },
        "stack": {
          "type": "string"
        }
      },
      "additionalProperties": true
    },
    "errors": {
      "type": "array",
      "items": {
        "type": "object",
        "properties": {
          "type": { "type": "string" },
          "message": { "type": "string" },
          "code": { "type": "string" },
          "retriable": { "type": "boolean" },
          "cause": { "type": "string" },
          "stack": { "type": "string" }
        },
        "additionalProperties": true
      }
    },
    "user": {
      "type": "object",
      "properties": {
        "id": {
          "type": "string"
        },
        "email": {
          "type": "string"
        },
        "plan": {
          "type": "string"
        }
      },
      "additionalProperties": true
    },
    "tenant": {
      "type": "object",
      "properties": {
        "id": {
          "type": "string"
        }
      },
      "additionalProperties": true
    },
    "workspace": {
      "type": "object",
      "properties": {
        "id": {
          "type": "string"
        }
      },
      "additionalProperties": true,
      "x-loxa-since": "v1"
    },
    "organization": {
      "type": "object",
      "properties": {
        "id": {
          "type": "string"
        }
      },
      "additionalProperties": true,
      "x-loxa-since": "v1"
    },
    "pii": {
      "type": "object",
      "properties": {
        "classification": {
          "type": "string",
          "enum": ["none", "low", "moderate", "high", "restricted"]
        },
        "redacted": {
          "type": "boolean"
        },
        "redaction_policy": {
          "type": "string"
        }
      },
      "additionalProperties": true,
      "x-loxa-since": "v1"
    },
    "resource": {
      "type": "object",
      "additionalProperties": true
    },
    "attrs": {
      "type": "object",
      "additionalProperties": true
    },
    "checkpoints": {
      "type": "array",
      "items": {
        "type": "object",
        "required": ["name", "at_ms"],
        "properties": {
          "name": { "type": "string", "minLength": 1 },
          "at_ms": { "type": "integer", "minimum": 0 },
          "attrs": { "type": "object", "additionalProperties": true }
        },
        "additionalProperties": true
      }
    },
    "processes": {
      "type": "array",
      "items": {
        "type": "object",
        "required": ["step", "name", "started_at_ms", "ended_at_ms", "duration_ms"],
        "properties": {
          "step": { "type": "integer", "minimum": 1 },
          "name": { "type": "string", "minLength": 1 },
          "started_at_ms": { "type": "integer", "minimum": 0 },
          "ended_at_ms": { "type": "integer", "minimum": 0 },
          "duration_ms": { "type": "integer", "minimum": 0 },
          "status_code": { "type": "integer" },
          "outcome": { "type": "string" },
          "attrs": { "type": "object", "additionalProperties": true },
          "error": { "type": "object", "additionalProperties": true }
        },
        "additionalProperties": true
      }
    },
    "groups": {
      "type": "array",
      "items": {
        "type": "object",
        "required": ["name", "started_at_ms", "ended_at_ms", "duration_ms"],
        "properties": {
          "name": { "type": "string", "minLength": 1 },
          "started_at_ms": { "type": "integer", "minimum": 0 },
          "ended_at_ms": { "type": "integer", "minimum": 0 },
          "duration_ms": { "type": "integer", "minimum": 0 },
          "status_code": { "type": "integer" },
          "outcome": { "type": "string" },
          "attrs": { "type": "object", "additionalProperties": true },
          "error": { "type": "object", "additionalProperties": true }
        },
        "additionalProperties": true
      }
    },
    "timers": {
      "type": "array",
      "items": {
        "type": "object",
        "required": ["name", "duration_ms"],
        "properties": {
          "name": { "type": "string", "minLength": 1 },
          "duration_ms": { "type": "integer", "minimum": 0 },
          "status_code": { "type": "integer" },
          "attrs": { "type": "object", "additionalProperties": true }
        },
        "additionalProperties": true
      }
    },
    "links": {
      "type": "array",
      "items": {
        "type": "object",
        "properties": {
          "type": { "type": "string" },
          "target": { "type": "string" },
          "attrs": { "type": "object", "additionalProperties": true }
        },
        "additionalProperties": true
      }
    },
    "sdk": {
      "type": "object",
      "properties": {
        "name": { "type": "string" },
        "version": { "type": "string" },
        "language": { "type": "string" }
      },
      "additionalProperties": true
    },
    "collector": {
      "type": "object",
      "additionalProperties": true
    },
    "sampling": {
      "type": "object",
      "additionalProperties": true
    },
    "redaction": {
      "type": "object",
      "additionalProperties": true
    }
  },
  "additionalProperties": true
}
